{
  "schema_version": "1",
  "quote_b64": "BAACAIEAAAAAAAAAk5pyM/ecTKmUCg2zlX8GB3OcPykqFbrOH3JjUacNS3kAAAAAAwAEAAAAAAAAAAAAAAAAAC/SecFhZKk91b83PYNDKNRgCMK2k6+eu4ZbCLLO0yDJqJtIaan6tg++nQxaU2PGVgAAAAAAAAAAAAAAAAAAAAAAAAAAAAAAAAAAAAAAAAAAAAAAAAAAAAAAAAAAAAAAAAAAAAAAAAAAAAAAQAAAAADnGgYAAAAAAGNjuAQ2aKOtlTJ44QOJV00ybGdJ+3iqgQ7NkzaSPbhvIvwAuNzUBLwQ1eEZ1yFcuwAAAAAAAAAAAAAAAAAAAAAAAAAAAAAAAAAAAAAAAAAAAAAAAAAAAAAAAAAAAAAAAAAAAAAAAAAAAAAAAAAAAAAAAAAAAAAAAAAAAAAAAAAAAAAAAAAAAAAAAAAAAAAAAAAAAAAAAAAAAAAAAAAAAAAAAAAAAAAAAAAAAAAAAAAAAAAAAAAAAAAAAAAAAAAAACkn2nBGHNYyZvQyMMwYScA+8l6+SQBiqAHY/MgK9Cl2gjrfCPgzweULUXecZZPzKixwC4upuFeD+L6fuUQ2R73AuzxQdH8GKXzGU4wlpfWJxLVtA1xZEHxrxYANssrLYYZS8Mqrp+IV6kQtw2pEmdj+wzYvOgssoVHL5LPmRm/lnHNos8Iof8fDv1ySTrRCTgAAAAAAAAAAAAAAAAAAAAAAAAAAAAAAAAAAAAAAAAAAAAAAAAAAAAAAAAAAAAAAAGxi3sG4GRdJox2rSQvlMqNZRN6kfK7x+YCGOZPZiZVF63QGo40e7TE7mHpGfazq1vDIem12bGb28p+KyygfERPLEAAA9RZvBphS2WzCzVcKWXPdsuiDL3DcqqlJpY67ENors1VBUxVKNjNtNMZXBRa0eKtFo2Tco79HZOx7pDoLhrzCezbzAf8dtcKC+TOJZsW49cclfnWwIQ0MbIsdSnhG5ODoTCEh1EjHFU03rOIQJHpuFycc0UaNuKx/zSRzs096Q/wGAEUQAAAEBA0PA/8AAwAAAAAAAAAAAAAAAAAAAAAAAAAAAAAAAAAAAAAAAAAAAAAAAAAAAAAVAAAAAAAAAOcAAAAAAAAAhT4pjzt83iiwZJPQb7Ktb5VmqX/qbT3mYjayrxo1FQ8AAAAAAAAAAAAAAAAAAAAAAAAAAAAAAAAAAAAAAAAAANyeKnxvlI8XR040p/xD7QMPfBVj8bq932NAyC4OVKjFAAAAAAAAAAAAAAAAAAAAAAAAAAAAAAAAAAAAAAAAAAAAAAAAAAAAAAAAAAAAAAAAAAAAAAAAAAAAAAAAAAAAAAAAAAAAAAAAAAAAAAAAAAAAAAAAAAAAAAAAAAAAAAAAAgAEAAAAAAAAAAAAAAAAAAAAAAAAAAAAAAAAAAAAAAAAAAAAAAAAAAAAAAAAAAAAAAAAAAAAAAAAAAAAAAAAAM8a4st2n/HyesUgNE5gkFRIpIvKbejxAUyS5aST2UEBAAAAAAAAAAAAAAAAAAAAAAAAAAAAAAAAAAAAAAAAAAAIu1x2xWHQc3JNiXUzj/cl0C/+bEgLXGcE830hRd4LiVtmC4UzBv+3lAAMfj5JlRr84NUD8KWN9bNFlewn4aR9IAAAAQIDBAUGBwgJCgsMDQ4PEBESExQVFhcYGRobHB0eHwUAXQ4AAC0tLS0tQkVHSU4gQ0VSVElGSUNBVEUtLS0tLQpNSUlFOFRDQ0JKZWdBd0lCQWdJVkFMdW13WFhZT0xqZk9RRE1OQkh5VDFFdEVFRUNNQW9HQ0NxR1NNNDlCQU1DCk1IQXhJakFnQmdOVkJBTU1HVWx1ZEdWc0lGTkhXQ0JRUTBzZ1VHeGhkR1p2Y20wZ1EwRXhHakFZQmdOVkJBb00KRVVsdWRHVnNJRU52Y25CdmNtRjBhVzl1TVJRd0VnWURWUVFIREF0VFlXNTBZU0JEYkdGeVlURUxNQWtHQTFVRQpDQXdDUTBFeEN6QUpCZ05WQkFZVEFsVlRNQjRYRFRJeU1Ea3lNREV6TWpBek1Wb1hEVEk1TURreU1ERXpNakF6Ck1Wb3djREVpTUNBR0ExVUVBd3daU1c1MFpXd2dVMGRZSUZCRFN5QkRaWEowYVdacFkyRjBaVEVhTUJnR0ExVUUKQ2d3UlNXNTBaV3dnUTI5eWNHOXlZWFJwYjI0eEZEQVNCZ05WQkFjTUMxTmhiblJoSUVOc1lYSmhNUXN3Q1FZRApWUVFJREFKRFFURUxNQWtHQTFVRUJoTUNWVk13V1RBVEJnY3Foa2pPUFFJQkJnZ3Foa2pPUFFNQkJ3TkNBQVJtCmxTblRpQzgraHRwT0JCOEFDeldoWXk0WmRvdFVzZ0xIaUNtUUNiZU9Tbyt1Z2VUTEVNVWFMNXBwUkI3QlhaM2gKY1NUeWw5SitxRlJuU3RJbUIxY2FvNElERERDQ0F3Z3dId1lEVlIwakJCZ3dGb0FVbFc5ZHpiMGI0ZWxBU2NuVQo5RFBPQVZjTDNsUXdhd1lEVlIwZkJHUXdZakJnb0Y2Z1hJWmFhSFIwY0hNNkx5OWhjR2t1ZEhKMWMzUmxaSE5sCmNuWnBZMlZ6TG1sdWRHVnNMbU52YlM5elozZ3ZZMlZ5ZEdsbWFXTmhkR2x2Ymk5Mk5DOXdZMnRqY213L1kyRTkKY0d4aGRHWnZjbTBtWlc1amIyUnBibWM5WkdWeU1CMEdBMVVkRGdRV0JCVE5VR2ZLejZGTnVzT0JBT3RJbHBOMworSFFBclRBT0JnTlZIUThCQWY4RUJBTUNCc0F3REFZRFZSMFRBUUgvQkFJd0FEQ0NBamtHQ1NxR1NJYjRUUUVOCkFRU0NBaW93Z2dJbU1CNEdDaXFHU0liNFRRRU5BUUVFRUFpZDM5dWNBMW5JS2p2SGNaSTVWMDR3Z2dGakJnb3EKaGtpRytFMEJEUUVDTUlJQlV6QVFCZ3NxaGtpRytFMEJEUUVDQVFJQkF6QVFCZ3NxaGtpRytFMEJEUUVDQWdJQgpBekFRQmdzcWhraUcrRTBCRFFFQ0F3SUJBakFRQmdzcWhraUcrRTBCRFFFQ0JBSUJBakFRQmdzcWhraUcrRTBCCkRRRUNCUUlCQWpBUUJnc3Foa2lHK0UwQkRRRUNCZ0lCQVRBUUJnc3Foa2lHK0UwQkRRRUNCd0lCQURBUUJnc3EKaGtpRytFMEJEUUVDQ0FJQkFqQVFCZ3NxaGtpRytFMEJEUUVDQ1FJQkFEQVFCZ3NxaGtpRytFMEJEUUVDQ2dJQgpBREFRQmdzcWhraUcrRTBCRFFFQ0N3SUJBREFRQmdzcWhraUcrRTBCRFFFQ0RBSUJBREFRQmdzcWhraUcrRTBCCkRRRUNEUUlCQURBUUJnc3Foa2lHK0UwQkRRRUNEZ0lCQURBUUJnc3Foa2lHK0UwQkRRRUNEd0lCQURBUUJnc3EKaGtpRytFMEJEUUVDRUFJQkFEQVFCZ3NxaGtpRytFMEJEUUVDRVFJQkN6QWZCZ3NxaGtpRytFMEJEUUVDRWdRUQpBd01DQWdJQkFBSUFBQUFBQUFBQUFEQVFCZ29xaGtpRytFMEJEUUVEQkFJQUFEQVVCZ29xaGtpRytFMEJEUUVFCkJBWlFnRzhBQUFBd0R3WUtLb1pJaHZoTkFRMEJCUW9CQVRBZUJnb3Foa2lHK0UwQkRRRUdCQkNNTVUwWDBnWGYKcjh2c3V3RDhoKy8zTUVRR0NpcUdTSWI0VFFFTkFRY3dOakFRQmdzcWhraUcrRTBCRFFFSEFRRUIvekFRQmdzcQpoa2lHK0UwQkRRRUhBZ0VCQURBUUJnc3Foa2lHK0UwQkRRRUhBd0VCL3pBS0JnZ3Foa2pPUFFRREFnTklBREJGCkFpRUFtak4xWUtTK1ZMclJHdzQvaStGekY3ODRMNlNnaGlEaW5QYTAxZ1Z2dzZZQ0lHU1VZNVdEelROSVlVQWgKbncxd0UrYlRsa1kxTXlIN3FZZzV4SGtIQjZyTAotLS0tLUVORCBDRVJUSUZJQ0FURS0tLS0tCi0tLS0tQkVHSU4gQ0VSVElGSUNBVEUtLS0tLQpNSUlDbGpDQ0FqMmdBd0lCQWdJVkFKVnZYYzI5RytIcFFFbkoxUFF6emdGWEM5NVVNQW9HQ0NxR1NNNDlCQU1DCk1HZ3hHakFZQmdOVkJBTU1FVWx1ZEdWc0lGTkhXQ0JTYjI5MElFTkJNUm93R0FZRFZRUUtEQkZKYm5SbGJDQkQKYjNKd2IzSmhkR2x2YmpFVU1CSUdBMVVFQnd3TFUyRnVkR0VnUTJ4aGNtRXhDekFKQmdOVkJBZ01Ba05CTVFzdwpDUVlEVlFRR0V3SlZVekFlRncweE9EQTFNakV4TURVd01UQmFGdzB6TXpBMU1qRXhNRFV3TVRCYU1IQXhJakFnCkJnTlZCQU1NR1VsdWRHVnNJRk5IV0NCUVEwc2dVR3hoZEdadmNtMGdRMEV4R2pBWUJnTlZCQW9NRVVsdWRHVnMKSUVOdmNuQnZjbUYwYVc5dU1SUXdFZ1lEVlFRSERBdFRZVzUwWVNCRGJHRnlZVEVMTUFrR0ExVUVDQXdDUTBFeApDekFKQmdOVkJBWVRBbFZUTUZrd0V3WUhLb1pJemowQ0FRWUlLb1pJemowREFRY0RRZ0FFTlNCLzd0MjFsWFNPCjJDdXpweHc3NGVKQjcyRXlER2dXNXJYQ3R4MnRWVExxNmhLazZ6K1VpUlpDbnFSN3BzT3ZncUZlU3hsbVRsSmwKZVRtaTJXWXozcU9CdXpDQnVEQWZCZ05WSFNNRUdEQVdnQlFpWlF6V1dwMDBpZk9EdEpWU3YxQWJPU2NHckRCUwpCZ05WSFI4RVN6QkpNRWVnUmFCRGhrRm9kSFJ3Y3pvdkwyTmxjblJwWm1sallYUmxjeTUwY25WemRHVmtjMlZ5CmRtbGpaWE11YVc1MFpXd3VZMjl0TDBsdWRHVnNVMGRZVW05dmRFTkJMbVJsY2pBZEJnTlZIUTRFRmdRVWxXOWQKemIwYjRlbEFTY25VOURQT0FWY0wzbFF3RGdZRFZSMFBBUUgvQkFRREFnRUdNQklHQTFVZEV3RUIvd1FJTUFZQgpBZjhDQVFBd0NnWUlLb1pJemowRUF3SURSd0F3UkFJZ1hzVmtpMHcraTZWWUdXM1VGLzIydWFYZTBZSkRqMVVlCm5BK1RqRDFhaTVjQ0lDWWIxU0FtRDV4a2ZUVnB2bzRVb3lpU1l4ckRXTG1VUjRDSTlOS3lmUE4rCi0tLS0tRU5EIENFUlRJRklDQVRFLS0tLS0KLS0tLS1CRUdJTiBDRVJUSUZJQ0FURS0tLS0tCk1JSUNqekNDQWpTZ0F3SUJBZ0lVSW1VTTFscWROSW56ZzdTVlVyOVFHemtuQnF3d0NnWUlLb1pJemowRUF3SXcKYURFYU1CZ0dBMVVFQXd3UlNXNTBaV3dnVTBkWUlGSnZiM1FnUTBFeEdqQVlCZ05WQkFvTUVVbHVkR1ZzSUVOdgpjbkJ2Y21GMGFXOXVNUlF3RWdZRFZRUUhEQXRUWVc1MFlTQkRiR0Z5WVRFTE1Ba0dBMVVFQ0F3Q1EwRXhDekFKCkJnTlZCQVlUQWxWVE1CNFhEVEU0TURVeU1URXdORFV4TUZvWERUUTVNVEl6TVRJek5UazFPVm93YURFYU1CZ0cKQTFVRUF3d1JTVzUwWld3Z1UwZFlJRkp2YjNRZ1EwRXhHakFZQmdOVkJBb01FVWx1ZEdWc0lFTnZjbkJ2Y21GMAphVzl1TVJRd0VnWURWUVFIREF0VFlXNTBZU0JEYkdGeVlURUxNQWtHQTFVRUNBd0NRMEV4Q3pBSkJnTlZCQVlUCkFsVlRNRmt3RXdZSEtvWkl6ajBDQVFZSUtvWkl6ajBEQVFjRFFnQUVDNm5Fd01ESVlaT2ovaVBXc0N6YUVLaTcKMU9pT1NMUkZoV0dqYm5CVkpmVm5rWTR1M0lqa0RZWUwwTXhPNG1xc3lZamxCYWxUVll4RlAyc0pCSzV6bEtPQgp1ekNCdURBZkJnTlZIU01FR0RBV2dCUWlaUXpXV3AwMGlmT0R0SlZTdjFBYk9TY0dyREJTQmdOVkhSOEVTekJKCk1FZWdSYUJEaGtGb2RIUndjem92TDJObGNuUnBabWxqWVhSbGN5NTBjblZ6ZEdWa2MyVnlkbWxqWlhNdWFXNTAKWld3dVkyOXRMMGx1ZEdWc1UwZFlVbTl2ZEVOQkxtUmxjakFkQmdOVkhRNEVGZ1FVSW1VTTFscWROSW56ZzdTVgpVcjlRR3prbkJxd3dEZ1lEVlIwUEFRSC9CQVFEQWdFR01CSUdBMVVkRXdFQi93UUlNQVlCQWY4Q0FRRXdDZ1lJCktvWkl6ajBFQXdJRFNRQXdSZ0loQU9XLzVRa1IrUzlDaVNEY05vb3dMdVBSTHNXR2YvWWk3R1NYOTRCZ3dUd2cKQWlFQTRKMGxySG9NcytYbzVvL3NYNk85UVd4SFJBdlpVR09kUlE3Y3ZxUlhhcUk9Ci0tLS0tRU5EIENFUlRJRklDQVRFLS0tLS0KCmV4dHJhIGJ5dGVzKG9ubHkgZm9yIHRlc3RpbmcgcHVycG9zZSkK",
  "collateral": {
    "tcb_info_json": "{\"tcbInfo\":{\"id\":\"TDX\",\"version\":3,\"issueDate\":\"2023-06-18T08:42:58Z\",\"nextUpdate\":\"2023-07-18T08:42:58Z\",\"fmspc\":\"50806f000000\",\"pceId\":\"0000\",\"tcbType\":0,\"tcbEvaluationDataNumber\":15,\"tdxModule\":{\"mrsigner\":\"000000000000000000000000000000000000000000000000000000000000000000000000000000000000000000000000\",\"attributes\":\"0000000000000000\",\"attributesMask\":\"FFFFFFFFFFFFFFFF\"},\"tcbLevels\":[{\"tcb\":{\"sgxtcbcomponents\":[{\"svn\":5,\"category\":\"BIOS\",\"type\":\"Early Microcode Update\"},{\"svn\":5,\"category\":\"OS/VMM\",\"type\":\"SGX Late Microcode Update\"},{\"svn\":2,\"category\":\"OS/VMM\",\"type\":\"TXT SINIT\"},{\"svn\":2,\"category\":\"BIOS\"},{\"svn\":3,\"category\":\"BIOS\"},{\"svn\":1,\"category\":\"BIOS\"},{\"svn\":0},{\"svn\":3,\"category\":\"OS/VMM\",\"type\":\"SEAMLDR ACM\"},{\"svn\":0},{\"svn\":0},{\"svn\":0},{\"svn\":0},{\"svn\":0},{\"svn\":0},{\"svn\":0},{\"svn\":0}],\"pcesvn\":11,\"tdxtcbcomponents\":[{\"svn\":3,\"category\":\"OS/VMM\",\"type\":\"TDX Module\"},{\"svn\":0,\"category\":\"OS/VMM\",\"type\":\"TDX Module\"},{\"svn\":5,\"category\":\"OS/VMM\",\"type\":\"TDX Late Microcode Update\"},{\"svn\":0},{\"svn\":0},{\"svn\":0},{\"svn\":0},{\"svn\":0},{\"svn\":0},{\"svn\":0},{\"svn\":0},{\"svn\":0},{\"svn\":0},{\"svn\":0},{\"svn\":0},{\"svn\":0}]},\"tcbDate\":\"2023-02-15T00:00:00Z\",\"tcbStatus\":\"UpToDate\"},{\"tcb\":{\"sgxtcbcomponents\":[{\"svn\":5,\"category\":\"BIOS\",\"type\":\"Early Microcode Update\"},{\"svn\":5,\"category\":\"OS/VMM\",\"type\":\"SGX Late Microcode Update\"},{\"svn\":2,\"category\":\"OS/VMM\",\"type\":\"TXT SINIT\"},{\"svn\":2,\"category\":\"BIOS\"},{\"svn\":3,\"category\":\"BIOS\"},{\"svn\":1,\"category\":\"BIOS\"},{\"svn\":0},{\"svn\":3,\"category\":\"OS/VMM\",\"type\":\"SEAMLDR ACM\"},{\"svn\":0},{\"svn\":0},{\"svn\":0},{\"svn\":0},{\"svn\":0},{\"svn\":0},{\"svn\":0},{\"svn\":0}],\"pcesvn\":5,\"tdxtcbcomponents\":[{\"svn\":3,\"category\":\"OS/VMM\",\"type\":\"TDX Module\"},{\"svn\":0,\"category\":\"OS/VMM\",\"type\":\"TDX Module\"},{\"svn\":5,\"category\":\"OS/VMM\",\"type\":\"TDX Late Microcode Update\"},{\"svn\":0},{\"svn\":0},{\"svn\":0},{\"svn\":0},{\"svn\":0},{\"svn\":0},{\"svn\":0},{\"svn\":0},{\"svn\":0},{\"svn\":0},{\"svn\":0},{\"svn\":0},{\"svn\":0}]},\"tcbDate\":\"2018-01-04T00:00:00Z\",\"tcbStatus\":\"OutOfDate\",\"advisoryIDs\":[\"INTEL-SA-00106\",\"INTEL-SA-00115\",\"INTEL-SA-00135\",\"INTEL-SA-00203\",\"INTEL-SA-00220\",\"INTEL-SA-00233\",\"INTEL-SA-00270\",\"INTEL-SA-00293\",\"INTEL-SA-00320\",\"INTEL-SA-00329\",\"INTEL-SA-00381\",\"INTEL-SA-00389\",\"INTEL-SA-00477\"]}]},\"signature\":\"f6502d6fad1e3b7281df2b7eddc773d5b5281187346c12c5647b4f243cea49212be96a7a1a6b5d83e36323fe3fa9dacd61ebfbc38e631ff0fe29ef14ae0db0b4\"}\n",